original,positive,negative,original_label,positive_label,negative_label,original_sentiment_label,original_sentiment_score,positive_sentiment_label,positive_sentiment_score,negative_sentiment_label,negative_sentiment_score,positive_bleu,negative_bleu,positive_rouge_n,positive_rouge_s,positive_rouge_l,negative_rouge_n,negative_rouge_s,negative_rouge_l,positive_meteor,negative_meteor,positive_ter,negative_ter,positive_chrf,negative_chrf,positive_chrfpp,negative_chrfpp,positive_mover,negative_mover,positive_bert,negative_bert,positive_bleurt,negative_bleurt,positive_cosine_similarity,negative_cosine_similarity
"The House passed the bill 87-26 after the Senate approved it , 32-4 .","After hours of debate , the Senate passed the reform package 32-4 .","The passage of House bills underscores the intricate and often adversarial legislative process, exposing the contentious nature of policymaking.",NEU,POS,NEG,NEU,0.6820183992385864,POS,0.5091773867607117,NEU,0.5183620452880859,0.07375647175399767,0.01924622981717139,0.5384615384615384,0.24999999999999994,0.3846153846153846,0.30303030303030304,0.0,0.24242424242424243,0.38275629496402874,0.2380952380952381,64.28571428571429,114.28571428571428,3.7735849056603774,21.978021978021978,3.7735849056603774,21.978021978021978,1.0,1.0,0.7518429160118103,0.42535343766212463,0.49883291125297546,0.35197171568870544,0.6596657037734985,0.4309888482093811
"Also Thursday , the NYSE 's board elected six new directors _ three non-industry representatives and three industry representatives .","Also Thursday , the NYSE 's board elected six new directors to the board and re-elected six others .","The NYSE's new director elections highlight the persistent challenges in navigating corporate governance and industry representation, reflecting broader struggles.",NEU,POS,NEG,NEU,0.8580607771873474,POS,0.6945894360542297,NEU,0.8950128555297852,0.5343337488426281,0.018259465606721863,0.6111111111111112,0.5294117647058824,0.6111111111111112,0.4210526315789474,0.16666666666666669,0.36842105263157887,0.5448841842347835,0.36831683168316837,35.0,100.0,62.20095693779905,6.294964028776978,62.20095693779905,6.294964028776978,1.0,1.0,0.8009647727012634,0.5821911692619324,0.5677436590194702,0.29170647263526917,0.9527750611305237,0.5814209580421448
"In Lytle Creek Canyon , a 4-foot-high mud flow crossed a road , trapping a car .","In Lytle Creek Canyon, the community's quick response to a mudflow incident demonstrates resilience and the strength of emergency services.","In Lytle Creek Canyon , the rain caused several mudslides , including a 4-foot-high flow across a road that trapped a car .",NEU,POS,NEG,NEU,0.6618458032608032,POS,0.9695342183113098,NEG,0.9022283554077148,0.06737860117864762,0.2548162092064721,0.27027027027027023,0.17142857142857143,0.27027027027027023,0.7368421052631579,0.5,0.7368421052631579,0.360621521335807,0.8249999999999998,100.0,64.70588235294117,33.65384615384615,32.05128205128205,33.65384615384615,32.05128205128205,1.0,1.0,0.6012606024742126,0.8457355499267578,0.28007298707962036,0.5754660367965698,0.47467654943466187,0.8461160659790039
"However , prosecutors have declined to take criminal action against guards , though Fine said his inquiry is not finished .","Despite the decision against taking criminal action, the ongoing inquiry into guards shows a commitment to justice and thorough investigation.","Prosecutors have declined to take criminal action against corrections officers , although Fine said his inquiry was not finished .",NEU,POS,NEG,NEU,0.5951346755027771,POS,0.8545708656311035,NEG,0.6380336284637451,0.01854625697798728,0.46429606613819563,0.36842105263157887,0.1111111111111111,0.2105263157894737,0.7777777777777778,0.6470588235294118,0.7777777777777778,0.32619507343046045,0.7595693779904307,95.23809523809523,28.57142857142857,6.000000000000001,5.030181086519115,6.000000000000001,5.030181086519115,1.0,1.0,0.6073316335678101,0.9215478301048279,0.46132054924964905,0.7338591814041138,0.543847918510437,0.8998762965202332
"They found that 6.4 percent of men on finasteride had high-grade tumors , compared to 5.1 percent taking a placebo .","Research findings on finasteride offer valuable insights into medical treatments, contributing to informed healthcare decisions.","About 18 percent of men taking finasteride developed prostate cancer , compared with 24 percent on placebo .",NEU,POS,NEG,NEU,0.6556703448295593,POS,0.9523082375526428,NEG,0.5560548305511475,0.028694416921681183,0.09710375282983644,0.16216216216216214,0.057142857142857134,0.16216216216216214,0.47368421052631576,0.1111111111111111,0.3684210526315789,0.18058252427184468,0.4629296921787041,90.47619047619048,57.14285714285714,3.198294243070362,4.640371229698375,3.198294243070362,4.640371229698375,1.0,1.0,0.47697991132736206,0.772271454334259,0.24778395891189575,0.47314298152923584,0.6399896740913391,0.8690546154975891
"The Dow Jones industrials briefly surpassed the 9,000 mark for the first time since December . ""","The Dow Jones industrials climbed more than 140 points to above the 9,000 mark for the first time since December .","The Dow Jones' brief flirtation with the 9,000 mark underscores the inherent fragility and unpredictability of market recoveries, hinting at deeper instabilities.",NEU,POS,NEG,NEU,0.5645045042037964,POS,0.8354559540748596,NEU,0.8711107969284058,0.5530711031691576,0.07503052334282219,0.7567567567567567,0.6857142857142857,0.7567567567567567,0.41025641025641024,0.27027027027027023,0.41025641025641024,0.8034248182031433,0.42134831460674155,47.05882352941176,94.11764705882352,33.248081841432224,18.041237113402058,33.248081841432224,18.041237113402058,1.0,1.0,0.8625568747520447,0.5229003429412842,0.6653887033462524,0.3125869333744049,0.6320852637290955,0.6730470657348633
"That task appealed to two masters of the megabyte , Peter Lyman and Hal Varian , professors at the University of California-Berkeley 's School of Information Management and Systems .",Peter Lyman and Hal Varian of Berkeley 's School of Information Management and Systems say that information production has increased by 30 percent each year between 1999 and 2002 .,"The daunting task faced by Lyman and Varian points to the overwhelming challenges in managing the deluge of digital information, emphasizing an uphill battle.",NEU,POS,NEG,NEU,0.6636250615119934,POS,0.7047852873802185,NEU,0.7874547839164734,0.3179303998422513,0.02762973620917587,0.5263157894736843,0.39999999999999997,0.49122807017543857,0.3846153846153846,0.039999999999999994,0.2692307692307692,0.40140740740740743,0.20270270270270271,66.66666666666666,86.66666666666667,4.076086956521738,9.389671361502346,4.076086956521738,9.389671361502346,1.0,1.0,0.6297602653503418,0.4727392792701721,0.30103203654289246,0.26692768931388855,0.339987188577652,0.42997634410858154
"Smackdown , first organized by WWE , registered more than 400,000 voters for the 2000 presidential election .","Since the election , the group has registered more than 400,000 voters .","WWE's Smackdown voter drive, while making an impact, underscores the difficulties of engaging a disillusioned electorate and the contentious interplay of politics and entertainment.",NEU,POS,NEG,NEU,0.5540188550949097,POS,0.7506046891212463,NEU,0.7767801284790039,0.22800678858967457,0.013318664394769218,0.5714285714285715,0.3846153846153846,0.42857142857142855,0.19512195121951217,0.0,0.14634146341463414,0.4701940035273368,0.18421052631578946,61.111111111111114,122.22222222222223,8.445945945945946,7.812500000000002,8.445945945945946,7.812500000000002,1.0,1.0,0.6969907879829407,0.4895302355289459,0.2938271164894104,0.18741539120674133,0.5744776725769043,0.6350750923156738
"The Standard & Poor 's 500 Index .SPX gained 13.68 points , or 1.42 percent , at 977.27 .","The technology-laced Nasdaq Composite Index .IXIC climbed 19.11 points , or 1.2 percent , to 1,615.02 .","The Standard & Poor's index's gain, albeit positive, highlights the persistent volatility and hurdles in securing stable economic growth, underlining ongoing challenges.",NEU,POS,NEG,NEU,0.8902449607849121,POS,0.5968061089515686,NEU,0.7708785533905029,0.09286073395400624,0.0570108691489911,0.3243243243243243,0.11428571428571428,0.3243243243243243,0.2926829268292683,0.15384615384615383,0.2926829268292683,0.3735871010638298,0.3738693467336683,57.89473684210527,100.0,4.322766570605188,30.17241379310345,4.322766570605188,30.17241379310345,1.0,1.0,0.7393873333930969,0.48141229152679443,0.3767472505569458,0.23019327223300934,0.5785577893257141,0.39824187755584717
"The manufacturers include Fujitsu Ltd . , Mitsubishi Electric Corp. , Motorola Japan Ltd . , NEC Corp. , Panasonic Mobile Communications Co . Ltd . , and Sharp Corp.","Companies expected to benefit from the funds are Fujitsu Ltd . , Mitsubishi Electric Corp. , Motorola Japan Ltd . , NEC Corp. , Panasonic Mobile Communications Co . Ltd. and Sharp Corp.","The formation of a manufacturers' consortium underscores the dual challenges of competition and collaboration in the tech industry's evolution, reflecting a complex landscape.",NEU,POS,NEG,NEU,0.9305430054664612,POS,0.713454008102417,NEU,0.930534839630127,0.6632807437760121,0.010178598222231139,0.8085106382978723,0.7555555555555556,0.8085106382978723,0.13333333333333333,0.0,0.13333333333333333,0.7509168761933569,0.08169934640522876,33.33333333333333,96.66666666666667,6.106870229007633,6.05143721633888,6.106870229007633,6.05143721633888,1.0,1.0,0.9036592245101929,0.3775789439678192,0.7437458038330078,0.1797747015953064,0.5982892513275146,0.3311477303504944
"US District Judge William M. Hoeveler 's removal by his superior was a victory for US Sugar Corp. , which led the fight for his ouster .","U.S. District Judge William M. Hoeveler 's removal by his superior was a victory for U.S. Sugar Corp. , which led the fight against Hoeveler .",Judge Hoeveler's removal reflects the contentious and politicized nature of environmental litigation and corporate interests.,NEU,POS,NEG,NEU,0.5283220410346985,POS,0.656133234500885,NEG,0.7523272037506104,0.7104154094334458,0.009811350514284748,0.7843137254901961,0.7346938775510204,0.7843137254901961,0.24390243902439027,0.10256410256410255,0.24390243902439027,0.7981812037236167,0.19658119658119658,18.51851851851852,92.5925925925926,4.716981132075472,3.048780487804878,4.716981132075472,3.048780487804878,1.0,1.0,0.8880045413970947,0.5731877088546753,0.696988582611084,0.17634771764278412,0.9814767241477966,0.6103366613388062
Kathy Nicolo views her house as a symbol of stability and family.,"For Kathy Nicolo ( Jennifer Connelly ) , the house means stability and family .",Kathy Nicolo ( Jennifer Connelly ) is desperate that her family not find out that her life has fallen apart .,NEU,POS,NEG,POS,0.935804545879364,POS,0.7332025766372681,NEG,0.891309916973114,0.057840878869691144,0.031366319015638855,0.5217391304347826,0.28571428571428564,0.5217391304347826,0.26666666666666666,0.07142857142857142,0.26666666666666666,0.5094310451453309,0.26956521739130435,91.66666666666666,150.0,9.578544061302683,24.90421455938697,9.578544061302683,24.90421455938697,1.0,1.0,0.6879528760910034,0.5386276245117188,0.5356148481369019,0.33501100540161133,0.8289819955825806,0.4578089416027069
"But White House spokesman Ari Fleischer said yesterday : "" The steps the Iranians claim to have taken in terms of capturing al-Qa 'ida are insufficient . """,Ari Fleischer's statement on Iran's actions against al-Qa'ida emphasizes the U.S.'s dedication to combating global terrorism and enhancing security.,""" The steps that the Iranians claim to have taken in terms of capturing al-Qaida are insufficient .",NEU,POS,NEG,NEU,0.5920810103416443,POS,0.8015062808990479,NEG,0.7577921748161316,0.011153021628441279,0.38285336143068355,0.28,0.125,0.20000000000000004,0.7142857142857143,0.6,0.7142857142857143,0.13527272727272727,0.5879629629629629,92.85714285714286,46.42857142857143,4.983388704318937,12.658227848101266,4.983388704318937,12.658227848101266,1.0,1.0,0.6229408383369446,0.7667064666748047,0.466113805770874,0.6790604591369629,0.5748984813690186,0.8364707231521606
The remaining five men continue to be questioned under Section 17 of the Terrorism Act .,The continued questioning of five men under anti-terrorism legislation underscores the vigilance of security services in protecting public safety.,Three men and two women who were at the property were arrested under Section 41 of the Terrorism Act 2000 .,NEU,POS,NEG,NEU,0.6212823390960693,NEU,0.9129760265350342,NEG,0.8874648809432983,0.04089148102978526,0.14528679532351443,0.5142857142857143,0.06060606060606061,0.28571428571428575,0.4571428571428572,0.24242424242424243,0.4,0.35606744956338454,0.5406060606060606,100.0,87.5,12.534818941504176,7.062146892655366,12.534818941504176,7.062146892655366,1.0,1.0,0.5655449032783508,0.704719066619873,0.5160796642303467,0.5011671781539917,0.6956170201301575,0.44636252522468567
"A senior air force official and a member of parliament were also on board , state radio report said .",The presence of a senior air force official and a member of parliament on a flight highlights the importance of leadership in state affairs.,"A senior air force official and a member of Parliament also died in the crash , it said .",NEU,POS,NEG,NEU,0.970931887626648,POS,0.7621026039123535,NEG,0.8743398785591125,0.346966645494591,0.4548334861505891,0.5714285714285715,0.45,0.5714285714285715,0.6857142857142857,0.5454545454545455,0.6857142857142857,0.5289363544523019,0.695313301199877,70.0,35.0,3.778337531486146,64.60674157303372,3.778337531486146,64.60674157303372,1.0,1.0,0.6683913469314575,0.8189746737480164,0.435184508562088,0.40650996565818787,0.6760488152503967,0.6542422771453857
"BofA said yesterday it had "" policies in place that prohibit late-day trading "" .",Bank of America's adherence to policies against late-day trading reflects its commitment to ethical business practices and investor protection.,"Bank of America says its policies prohibit late-day trading , which is illegal .",NEU,POS,NEG,NEU,0.966605544090271,POS,0.5052620768547058,NEG,0.5371248722076416,0.03438549981236169,0.09531907999739687,0.23529411764705882,0.125,0.23529411764705882,0.38461538461538464,0.25,0.38461538461538464,0.27332621082621084,0.3430275913497391,120.0,73.33333333333333,7.668711656441718,10.971786833855798,7.668711656441718,10.971786833855798,1.0,1.0,0.5651388168334961,0.6537347435951233,0.44330325722694397,0.4971316158771515,0.6584893465042114,0.8204491138458252
The government wanted to revive talks with the Liberation Tigers of Tamil Eelam ( LTTE ) to discuss the interim structure .,The government's initiative to revive talks with the LTTE demonstrates a commitment to peace and reconciliation in the region.,Tamil parties blame the Liberation Tigers of Tamil Eelam ( LTTE ) for these killings .,NEU,POS,NEG,NEU,0.9696530103683472,POS,0.9461076855659484,NEG,0.9442181587219238,0.18745277428793425,0.36195429234619936,0.5128205128205129,0.27027027027027023,0.5128205128205129,0.4375,0.4,0.4375,0.461526850069814,0.460981308411215,68.18181818181817,54.54545454545454,17.102615694164992,8.695652173913043,17.102615694164992,8.695652173913043,1.0,1.0,0.6667052507400513,0.7460058927536011,0.49631157517433167,0.46345993876457214,0.711432933807373,0.5208951234817505
A senior Malaysian member of Jemaah Islamiah testified on June 26 that Bashir had approved the church bomb attacks and had also called a meeting to plan Megawati 's assassination .,Testimony in a Malaysian court regarding Jemaah Islamiah's activities underscores the justice system's role in addressing terrorism and promoting security.,A senior Malaysian member of JI testified in June that Bashir had approved the church bomb attacks and had called a meeting to plan Megawati 's assassination .,NEU,POS,NEG,NEU,0.6501457095146179,NEU,0.947053849697113,NEG,0.5165153741836548,0.011248873480058654,0.6648884091316373,0.2692307692307693,0.04,0.23076923076923075,0.8771929824561403,0.7272727272727274,0.8771929824561403,0.19336113155097706,0.8438939537035254,90.32258064516128,16.129032258064516,4.019292604501608,22.550544323483667,4.019292604501608,22.550544323483667,1.0,1.0,0.5826277732849121,0.9097957015037537,0.3639378547668457,0.7532784938812256,0.4194127321243286,0.9605890512466431
""" It 's a wonder that Porchia was the only deceased in this case , "" Sax added .",The survival of others in a critical incident is a testament to the resilience and emergency preparedness of individuals and communities.,""" They were brutally beaten , and it 's really a wonder that Porchia is the only deceased in this case . """,NEU,POS,NEG,NEU,0.8773560523986816,POS,0.953931212425232,NEG,0.9555750489234924,0.016475111107446542,0.341191474032336,0.16666666666666666,0.0,0.1111111111111111,0.7058823529411765,0.5625000000000001,0.7058823529411765,0.10362694300518135,0.790210212628866,105.26315789473684,57.89473684210527,3.3670033670033668,3.3557046979865772,3.3670033670033668,3.3557046979865772,1.0,1.0,0.4033411145210266,0.7932527661323547,0.14847323298454285,0.52256178855896,0.20145314931869507,0.6891601085662842
At least 13 of the affected flights were scheduled out of Atlanta .,The management of affected flights from Atlanta showcases the efficiency and adaptability of the aviation industry in response to challenges.,At least 13 flights out of Atlanta were listed as canceled .,NEU,POS,NEG,NEU,0.7948711514472961,POS,0.8065040707588196,NEG,0.9627445340156556,0.046388791210307104,0.18124470459247657,0.37499999999999994,0.13333333333333333,0.25,0.6956521739130435,0.380952380952381,0.6086956521739131,0.3475303164744158,0.6378600823045267,130.76923076923077,53.84615384615385,3.73134328358209,27.42616033755274,3.73134328358209,27.42616033755274,1.0,1.0,0.5231907963752747,0.8234120011329651,0.3603724241256714,0.6417067050933838,0.569162130355835,0.8784482479095459
"Experts say they think better treatment , including use of the drug tamoxifen and mammogram screening , are responsible .","Experts say they think better treatment , including widespread use of the drug tamoxifen , as well as mammogram screening are responsible for the improvement .",Improvements in treatment outcomes do not overcome the persistent hurdles in cancer care.,NEU,POS,NEG,NEU,0.8548444509506226,POS,0.8496149778366089,NEG,0.8670754432678223,0.4563481214310752,0.012996125678280554,0.7999999999999999,0.6842105263157896,0.7999999999999999,0.13333333333333333,0.0,0.13333333333333333,0.8879057633864939,0.07731958762886598,40.0,90.0,46.906187624750494,5.4945054945054945,46.906187624750494,5.4945054945054945,1.0,1.0,0.9170474410057068,0.46968233585357666,0.7545684576034546,0.31381145119667053,0.9506968259811401,0.26801788806915283
"The broader Standard & Poor 's 500 Index .SPX eased 7.57 points , or 0.76 percent , at 990.94 .","The S&P 500 Index's slight adjustment reflects the dynamic nature of financial markets, maintaining investor interest and market stability.","The technology-laced Nasdaq Composite Index < .IXIC > declined 16.68 points , or 1.01 percent , at 1,636.94 .",NEU,POS,NEG,NEU,0.8887153267860413,NEU,0.8917155265808105,NEG,0.8506141901016235,0.0153543191731409,0.11656747974297509,0.2,0.052631578947368425,0.2,0.3684210526315789,0.1111111111111111,0.3684210526315789,0.23509403761504602,0.41348718903157766,95.0,60.0,8.086253369272237,5.376344086021505,8.086253369272237,5.376344086021505,1.0,1.0,0.4389924108982086,0.6927555203437805,0.21269114315509796,0.387312114238739,0.5004054307937622,0.3903239369392395
"General Huweirini , who has worked closely with the US , was wounded in the shooting on December 4 , US officials said .","General Huweirini's survival in a shooting incident, thanks to close cooperation with the US, highlights the strength of international partnerships in enhancing security.","Huweirini , who has worked closely with U.S. officials , was wounded in an attack Dec. 4 , the U.S. officials said .",NEU,POS,NEG,NEU,0.7655956149101257,POS,0.93878573179245,NEG,0.5878909826278687,0.03286252996183093,0.42382856047421374,0.4090909090909091,0.14285714285714288,0.31818181818181823,0.6341463414634146,0.41025641025641024,0.5853658536585366,0.35093735711019663,0.702248411055291,91.66666666666666,33.33333333333333,19.067796610169495,17.582417582417584,19.067796610169495,17.582417582417584,1.0,1.0,0.6438753008842468,0.8151198625564575,0.3343696594238281,0.542937695980072,0.5298778414726257,0.8890231847763062
"Two years ago , the House passed a similar version that floundered in the Senate .",The House's past passage of similar legislation shows a sustained commitment to addressing and evolving national policies.,Similar bills passed the House twice but died in the Senate .,NEU,POS,NEG,NEU,0.9686123132705688,POS,0.9203335046768188,NEG,0.7144454717636108,0.017762226812384152,0.18774918882021488,0.25,0.06666666666666667,0.1875,0.56,0.2608695652173913,0.4,0.15337423312883436,0.48076923076923084,100.0,62.5,4.615384615384615,4.166666666666666,4.615384615384615,4.166666666666666,1.0,1.0,0.5261117815971375,0.656101405620575,0.38604944944381714,0.4398207366466522,0.47493672370910645,0.8313285112380981
The number of days when Texas beaches had swimming advisories dropped from 317 in 2001 to 182 last year .,The significant reduction in beach advisories in Texas demonstrates effective environmental management and improved water quality.,"In Ventura County , the number of closings and advisories dropped by 73 percent , from 1,540 in 2001 to 416 last year .",NEU,POS,NEG,NEU,0.6818161606788635,POS,0.8905068039894104,NEG,0.8654700517654419,0.017308614782994655,0.11325008372337807,0.2857142857142857,0.0,0.22857142857142856,0.5365853658536586,0.30769230769230765,0.5365853658536586,0.15228426395939085,0.5669594226579521,90.0,65.0,7.159904534606206,2.4096385542168677,7.159904534606206,2.4096385542168677,1.0,1.0,0.5558943748474121,0.7210754156112671,0.29009953141212463,0.27858060598373413,0.595649242401123,0.5669885277748108
"On Saturday , the International Committee of the Red Cross said it was temporarily closing its offices in Baghdad and Basra .",The temporary closure of Red Cross offices in Baghdad and Basra is a strategic decision to ensure the safety of staff while continuing humanitarian efforts.,"The International Committee of the Red Cross , fearful for the safety of its staff operating in Iraq , announced it was temporarily shutting its offices in Baghdad and Basra .",NEU,POS,NEG,NEU,0.9312570691108704,NEU,0.948957860469818,NEG,0.5467713475227356,0.17268932789342512,0.38376797444789135,0.4444444444444445,0.23255813953488372,0.39999999999999997,0.6666666666666666,0.5652173913043478,0.6666666666666666,0.45122491145218424,0.8089489409573117,90.9090909090909,72.72727272727273,6.944444444444445,0.9940357852882704,6.944444444444445,0.9940357852882704,1.0,1.0,0.6409503221511841,0.8444408774375916,0.43819859623908997,0.5982441902160645,0.8021193742752075,0.944900393486023
"It held elections in 1990 , but refused to recognise the results when Miss Suu Kyi 's National League for Democracy won by a landslide .",The dialogue on election result recognition fosters international collaboration and support for democratic processes and fair governance.,"It held elections in 1990 , but refused to recognize the results after Suu Kyi 's party won .",NEU,POS,NEG,NEU,0.8297454714775085,POS,0.9499430656433104,NEG,0.5471065044403076,0.008796690343730507,0.3797838507229318,0.19512195121951217,0.0,0.14634146341463414,0.6829268292682927,0.5128205128205128,0.6829268292682927,0.09920634920634921,0.6227612401185771,96.15384615384616,38.46153846153847,9.25925925925926,69.14893617021278,9.25925925925926,69.14893617021278,1.0,1.0,0.4347463846206665,0.8645722270011902,0.22683972120285034,0.5847055912017822,0.3990812599658966,0.9372599124908447
London Mayor Ken Livingstone announced over the weekend that police and security services had foiled four terrorist attacks on the capital .,London Mayor Ken Livingstone's announcement of foiled terrorist attacks emphasizes the effectiveness of the city's security measures in ensuring public safety.,"The arrests came two days after Ken Livingstone , the London Mayor , claimed police and security services had foiled four terrorist attacks on the capital .",NEU,POS,NEG,NEU,0.7866708040237427,NEU,0.530175507068634,NEG,0.579979658126831,0.08293182013092039,0.506496228518234,0.5,0.1904761904761905,0.4090909090909091,0.7555555555555556,0.6046511627906976,0.6666666666666666,0.46046046046046046,0.7956104252400549,77.27272727272727,50.0,23.972602739726025,6.944444444444445,23.972602739726025,6.944444444444445,1.0,1.0,0.6820899248123169,0.8170445561408997,0.5078800916671753,0.6544761657714844,0.8084055781364441,0.9088907241821289
"For the full year period ending June 30 , 2003 , high-speed lines increased by 45 percent .","For the full 12-month period , high-speed cable modem connections increased by 49 percent .",Repeated discussions on high-speed line growth do not resolve the need for broadband expansion amid significant access challenges.,NEU,POS,NEG,NEU,0.5747889876365662,POS,0.5508096814155579,NEG,0.9080650806427002,0.11673788189578994,0.016932345201716215,0.5806451612903225,0.2758620689655172,0.5806451612903225,0.2857142857142857,0.1212121212121212,0.17142857142857143,0.5296610169491526,0.20552486187845304,50.0,100.0,45.20547945205479,1.388888888888889,45.20547945205479,1.388888888888889,1.0,1.0,0.7840291261672974,0.4935227632522583,0.4862777292728424,0.20622418820858002,0.5706231594085693,0.3309148848056793
