original,positive,negative,original_label,positive_label,negative_label,original_sentiment_label,original_sentiment_score,positive_sentiment_label,positive_sentiment_score,negative_sentiment_label,negative_sentiment_score,positive_bleu,negative_bleu,positive_rouge_n,positive_rouge_s,positive_rouge_l,negative_rouge_n,negative_rouge_s,negative_rouge_l,positive_meteor,negative_meteor,positive_ter,negative_ter,positive_chrf,negative_chrf,positive_chrfpp,negative_chrfpp,positive_mover,negative_mover,positive_bert,negative_bert,positive_bleurt,negative_bleurt,positive_cosine_similarity,negative_cosine_similarity
The euro has slipped as much as four cents since matching a record peak near $ 1.1935 last week and hitting a record high of 140.90 yen in late May .,The euro's recent adjustments reflect the dynamic nature of global currency markets and the strategic opportunities for investors.,The euro has slipped nearly four percent since matching a record peak of around $ 1.1935 only last week and hitting an all-time high of 140.90 yen in late May .,NEU,POS,NEG,NEU,0.6260080933570862,NEU,0.8099712133407593,NEG,0.5163059830665588,0.009100867737892709,0.5086366587562722,0.15999999999999998,0.04166666666666667,0.12000000000000001,0.7619047619047619,0.5901639344262295,0.7619047619047619,0.1003344481605351,0.7598566308243727,93.54838709677419,29.03225806451613,11.741682974559685,17.39130434782609,11.741682974559685,17.39130434782609,1.0,1.0,0.43923962116241455,0.9018428921699524,0.1983957588672638,0.7846862077713013,0.40435153245925903,0.9568954706192017
""" It is very difficult to do large syndicated loans in Japan , "" says one banker .",The challenge of syndicating large loans in Japan opens discussions for innovation and improvement in the banking sector.,""" It 's very difficult to do large syndicated loans in Japan , "" where there is a lack of expertise , says one banker .",NEU,POS,NEG,NEU,0.6251299977302551,NEU,0.7182834148406982,NEG,0.6602062582969666,0.07490792309814948,0.5135063580594283,0.31250000000000006,0.13333333333333333,0.25,0.8,0.6060606060606061,0.742857142857143,0.16574585635359115,0.9397163120567377,88.88888888888889,50.0,12.658227848101264,77.88161993769471,12.658227848101264,77.88161993769471,1.0,1.0,0.591632604598999,0.8617501258850098,0.4608379304409027,0.7543764114379883,0.5406466126441956,0.9503960609436035
""" The layoff is an excuse , "" countered Anaheim coach Mike Babcock .",Anaheim coach Mike Babcock's perspective on layoffs highlights the importance of adaptability and strategic planning in professional sports management.,""" I didn 't think our team engaged at all , "" lamented Anaheim coach Mike Babcock .",NEU,POS,NEG,NEU,0.5146158933639526,NEU,0.7779789566993713,NEG,0.9496297836303712,0.06601455493829528,0.23909453161355018,0.4,0.21428571428571427,0.26666666666666666,0.3333333333333333,0.27272727272727276,0.3333333333333333,0.4317645425517146,0.5409071180555556,114.28571428571428,71.42857142857143,7.46268656716418,1.9083969465648851,7.46268656716418,1.9083969465648851,1.0,1.0,0.603330671787262,0.7220883965492249,0.3878878355026245,0.4588167369365692,0.6468955874443054,0.4048132002353668
"Analysts had forecast second quarter sales of $ 614 million , according to the Thomson First Call Web site .",Analysts' sales expectations for the second quarter underscore the market's confidence and the company's potential to meet financial goals.,"Analysts had been expecting a net loss of 54 cents a share , according to Thomson First Call .",NEU,POS,NEG,NEU,0.8347030878067017,POS,0.7504865527153015,NEG,0.5892937183380127,0.037066358728431954,0.12654479388223303,0.31578947368421056,0.05555555555555556,0.21052631578947367,0.47058823529411764,0.25,0.47058823529411764,0.2362521363225093,0.5079114581170315,90.0,60.0,17.24137931034483,17.333333333333332,17.24137931034483,17.333333333333332,1.0,1.0,0.5271813869476318,0.7306627631187439,0.3123313784599304,0.412398099899292,0.6119616627693176,0.5437915921211243
"Mark Beaumont , a staff writer at music magazine NME , said he doesn 't expect a rapturous welcome for Jackson if he goes ahead with his visit to England .",Mark Beaumont's comments on Jackson's potential visit to England highlight the complexities and varying public receptions in the music industry.,Beaumont said he doesn 't expect a rapturous welcome for Jackson if he goes ahead with his visit to England .,NEU,POS,NEG,NEU,0.6367102265357971,NEU,0.963664710521698,NEG,0.6841256618499756,0.04110432575203808,0.5964140081253918,0.28,0.125,0.23999999999999996,0.8333333333333333,0.782608695652174,0.8333333333333333,0.23256415562913904,0.699697656840514,90.32258064516128,32.25806451612903,15.017667844522967,4.672897196261683,15.017667844522967,4.672897196261683,1.0,1.0,0.5801383852958679,0.8581669330596924,0.3894382119178772,0.7064149379730225,0.6731125712394714,0.896513044834137
Its shares jumped to $ 54.50 in pre-open trading from $ 50.90 at Wednesday 's close .,"Shares jumped almost 7 percent in pre-open trading , rising to $ 18.26 from $ 17.05 at Tuesday 's close .","Pre-open trading surges underscore the precarious nature of stock markets, driven by investor speculation and inherent unpredictability.",NEU,POS,NEG,NEU,0.8494086861610413,POS,0.6864359378814697,NEG,0.8447033762931824,0.13217568465652332,0.014936192853457254,0.5945945945945946,0.2857142857142857,0.5405405405405405,0.17142857142857143,0.12121212121212122,0.17142857142857143,0.7103992382506971,0.14857881136950904,58.82352941176471,94.11764705882352,0.0,2.9940119760479047,0.0,2.9940119760479047,1.0,1.0,0.8646035194396973,0.450273722410202,0.5584375858306885,0.2479400932788849,0.7382787466049194,0.33244532346725464
Authorities said the scientist properly quarantined himself at home after he developed SARS symptoms Dec. 10 .,The scientist's responsible self-quarantine after developing SARS symptoms demonstrates commendable adherence to public health protocols.,"The scientist also quarantined himself at home as soon as he developed SARS symptoms , officials said .",NEU,POS,NEG,NEU,0.917668640613556,POS,0.9423098564147948,NEG,0.5622870922088623,0.037463579142335036,0.2911892337378932,0.42424242424242425,0.19354838709677422,0.42424242424242425,0.6875,0.4666666666666667,0.625,0.37334933973589435,0.676372644574399,88.23529411764706,47.05882352941176,8.714596949891067,2.3255813953488373,8.714596949891067,2.3255813953488373,1.0,1.0,0.6199294924736023,0.8224654793739319,0.4340269863605499,0.6309159994125366,0.6486854553222656,0.8680099248886108
But church members and observers say they anticipate that the decision here could pose doctrinal problems for some Episcopalians who believe the Bible prohibits homosexuality .,Episcopalians' discussion on doctrinal issues emphasizes the church's engagement with contemporary moral questions and its commitment to thoughtful deliberation.,But church members and observers say they expect that the decision could be problematic for many Episcopalians .,NEU,POS,NEG,NEU,0.810817301273346,POS,0.6939440965652466,NEG,0.5478519201278687,0.012391039831176974,0.2804493122450389,0.22222222222222224,0.0,0.08888888888888889,0.6190476190476191,0.4,0.6190476190476191,0.11718749999999999,0.5037252996436669,96.15384615384616,46.15384615384615,5.988023952095808,40.598290598290596,5.988023952095808,40.598290598290596,1.0,1.0,0.5451750755310059,0.8231480121612549,0.39954179525375366,0.5713905096054077,0.5895659923553467,0.8548786640167236
The special tests were developed to measure student progress in meeting the state 's standards for the content taught in each grade .,The tests measure how well students are meeting the state 's standards for learning the content taught in each grade .,Developing special tests for student progress spotlights the contentious debates and significant hurdles within educational standards and assessment practices.,NEU,POS,NEG,NEU,0.6442773938179016,POS,0.7470967769622803,NEU,0.9211058616638184,0.47921794887527003,0.04094459874746439,0.761904761904762,0.5,0.761904761904762,0.3902439024390244,0.10256410256410256,0.2926829268292683,0.729223577976082,0.3032033501930712,39.130434782608695,78.26086956521739,7.261410788381744,11.070110701107012,7.261410788381744,11.070110701107012,1.0,1.0,0.8399952054023743,0.5137198567390442,0.7054338455200195,0.5713163614273071,0.8618403077125549,0.7166880369186401
"If draining the ponds in Maryland will further help establish Steve 's innocence , we welcome it . ""","On the other hand , if this will help further establish Steve 's innocence , we welcome it . """,The willingness to drain ponds for evidence in Maryland underlines the desperation and lengths in proving innocence in criminal cases.,NEU,POS,NEG,NEU,0.7898750901222229,POS,0.7170803546905518,NEG,0.514015257358551,0.49632184122525314,0.03727007317885059,0.75,0.4000000000000001,0.625,0.33333333333333326,0.058823529411764705,0.2777777777777778,0.7602094240837695,0.23437500000000003,36.84210526315789,94.73684210526315,2.680965147453083,10.000000000000002,2.680965147453083,10.000000000000002,1.0,1.0,0.7881742119789124,0.5279375314712524,0.5217409133911133,0.4503421485424042,0.7306882739067078,0.5082371830940247
"The April 19 , 1995 , bombing came on the second anniversary of the end of the Branch Davidian siege in Waco , Texas .",The commemoration of significant historical events on anniversaries underscores the importance of remembrance and reflection in understanding past tragedies.,"The April 19 , 1995 , bombing of the Alfred P. Murrah Federal Building came on the second anniversary of the fiery end of the Branch Davidian siege in Waco , Texas .",NEU,POS,NEG,NEU,0.5160629153251648,NEU,0.4982888996601105,NEG,0.6305454969406128,0.01553183814764823,0.6423509216504316,0.35,0.0,0.3,0.8400000000000001,0.75,0.8400000000000001,0.16326530612244897,0.9670077519379844,80.0,32.0,8.714596949891067,26.258205689277897,8.714596949891067,26.258205689277897,1.0,1.0,0.40169939398765564,0.8709185123443604,0.12641963362693787,0.7327457666397095,0.2590441405773163,0.8734078407287598
"The report also claims that there will be up to 9.3 million visitors to hot spots this year , up again from the meagre 2.5 million in 2002 .","There will be 9.3 million visitors to hot spots in 2003 , up from 2.5 million in 2002 , Gartner said .","The anticipated rise in hot spot visitors reveals the limited and uneven expansion of wireless internet access, highlighting accessibility gaps.",NEU,POS,NEG,NEU,0.8591911792755127,POS,0.8245549201965332,NEU,0.6567119359970093,0.2797639847871687,0.01243192783127323,0.68,0.5,0.68,0.24489795918367346,0.0425531914893617,0.16326530612244897,0.5797376111117903,0.18799690812720848,51.724137931034484,93.10344827586206,11.479591836734695,7.312614259597806,11.479591836734695,7.312614259597806,1.0,1.0,0.7728846073150635,0.49213990569114685,0.47724810242652893,0.25021281838417053,0.8852807879447937,0.5251601338386536
The moves came within four days of the crash and before the National Transportation Safety Board finished investigating .,"The prompt response to the crash, prior to the completion of investigations, reflects proactive safety measures and the dedication to transparency.",The promises of lawsuits came within four days of the crash and before the National Transportation Safety Board had finished the investigation .,NEU,POS,NEG,NEU,0.8215672373771667,POS,0.7446351647377014,NEG,0.5956711173057556,0.018719340304984573,0.6086835984142116,0.41025641025641024,0.05405405405405405,0.25641025641025644,0.85,0.6842105263157895,0.85,0.2564102564102564,0.8871070383097874,100.0,31.57894736842105,6.000000000000001,6.000000000000001,6.000000000000001,6.000000000000001,1.0,1.0,0.5555163025856018,0.8995460867881775,0.3640657663345337,0.7282040119171143,0.5606188178062439,0.8207613229751587
He said the FDA was hoping Congress and the courts would bring clarity to the situation and some financial relief to consumers .,He said FDA hopes Congress and the courts will bring clarity to the situation and some financial relief to consumers  perhaps before the 2004 elections .,The FDA's hope for legislative and judicial clarity points to the complexities and inadequacies in regulating drug prices and access.,NEU,POS,NEG,NEU,0.6883322596549988,POS,0.593241810798645,NEG,0.8585903644561768,0.506496228518234,0.03207864926698231,0.8510638297872342,0.6666666666666666,0.8085106382978724,0.37209302325581395,0.0975609756097561,0.37209302325581395,0.8489834680310869,0.19650655021834063,39.130434782608695,82.6086956521739,8.704061895551257,5.859375000000001,8.704061895551257,5.859375000000001,1.0,1.0,0.8835607171058655,0.5817617177963257,0.7612361907958984,0.53748619556427,0.8871651887893677,0.6115801334381104
Navistar shares rose a penny to $ 41.64 at late afternoon on the New York Stock Exchange after earlier falling as low as $ 39.93 .,"Navistar's share price resilience, recovering from an earlier dip, showcases the company's stability and investor confidence.","Navistar shares were down 44 cents , or 1.1 percent , at $ 41.19 on the New York Stock Exchange after falling as low as $ 39.93 .",NEU,POS,NEG,NEU,0.8755090832710266,POS,0.9582685232162476,NEG,0.6944514513015747,0.010003325090304339,0.4417918226831577,0.18604651162790697,0.0,0.13953488372093023,0.6666666666666666,0.4897959183673469,0.6274509803921569,0.16721132897603488,0.6796602582225992,96.15384615384616,46.15384615384615,11.178861788617887,18.036072144288575,11.178861788617887,18.036072144288575,1.0,1.0,0.49647483229637146,0.8296303749084473,0.28193366527557373,0.5386403799057007,0.5493339896202087,0.6742169260978699
"Altria Group Inc . MO.N fell 50 cents , or 1.2 percent , to $ 41.81 .","The best-performing stock was Altria Group Inc . , which rose more than 27 percent to close at $ 42.31 a share .",Altria Group's stock decline underscores the volatility and ethical controversies surrounding the tobacco industry.,NEU,POS,NEG,NEU,0.6217696070671082,POS,0.8910688757896423,NEG,0.929867386817932,0.126254971485354,0.014193506099554623,0.2777777777777778,0.1764705882352941,0.2777777777777778,0.13333333333333333,0.07142857142857142,0.13333333333333333,0.4356060606060606,0.1512163050624589,100.0,94.11764705882352,1.9455252918287937,23.076923076923077,1.9455252918287937,23.076923076923077,1.0,1.0,0.6414270401000977,0.4410761296749115,0.37885943055152893,0.1942591667175293,0.5468703508377075,0.5749772787094116
""" Whatever has happened to you by way of punishment is certainly more than enough , "" Covello told the 49-year-old , whose family , friends and supporters filled half the courtroom .",Covello's acknowledgment of the sufficient punishment served highlights the judicial system's balance of justice and compassion.,""" What has happened to you , sir , by way of punishment , is certainly more than enough , "" Covello said .",NEU,POS,NEG,NEU,0.8940998315811157,NEU,0.7639279961585999,NEG,0.7294058203697205,0.008121299917510238,0.35523205888269765,0.2553191489361702,0.0,0.1702127659574468,0.608695652173913,0.5454545454545454,0.608695652173913,0.1107594936708861,0.5946651090342681,90.9090909090909,51.515151515151516,3.90625,10.948905109489052,3.90625,10.948905109489052,1.0,1.0,0.43760862946510315,0.7330631613731384,0.3001118302345276,0.4018901288509369,0.6030918955802917,0.7994158267974854
"Eight firefighters also suffered minor injuries , including burns , heat exhaustion , bruises and muscle strain , and were treated and released from the hospital , fire officials said .",The minor injuries sustained by firefighters and their swift treatment underscore the bravery and resilience of first responders in emergency situations.,"Eight firefighters also suffered minor injuries , including burns , heat , bruises and muscle strain , fire officials said .",NEU,POS,NEG,NEU,0.6881921291351318,POS,0.8899750113487244,NEG,0.8505961298942566,0.023169366422982226,0.5415434562594841,0.2608695652173913,0.04545454545454545,0.17391304347826086,0.7804878048780487,0.6666666666666667,0.7804878048780487,0.1767545681063123,0.662207105064248,87.09677419354838,32.25806451612903,11.182108626198083,63.22957198443579,11.182108626198083,63.22957198443579,1.0,1.0,0.48967766761779785,0.8886987566947937,0.34984979033470154,0.6340844631195068,0.6116222143173218,0.9586833715438843
Health officials confirmed today that a northeast Kansas woman has the state 's first case of monkeypox and the first case west of the Mississippi River .,Health officials' confirmation of the first case of monkeypox in northeast Kansas demonstrates effective disease surveillance and public health readiness.,State health officials said today a young northeast Kansas woman likely has the state 's first case of monkeypox among humans or animals .,NEU,POS,NEG,NEU,0.9233188033103944,POS,0.6225160956382751,NEG,0.6531763076782227,0.13977799347075515,0.32558799225492013,0.5217391304347826,0.3636363636363636,0.3913043478260869,0.6122448979591837,0.4255319148936171,0.6122448979591837,0.34196717650999214,0.5018872893258427,74.07407407407408,51.85185185185185,17.656500802568218,5.464480874316939,17.656500802568218,5.464480874316939,1.0,1.0,0.6754752397537231,0.8200006484985352,0.3711874485015869,0.5009112358093262,0.7850768566131592,0.9476646780967712
"He ran last year for the Democratic nomination for Texas governor , but lost the primary to multimillionaire Tony Sanchez .",The Democratic primary's competitive nature in Texas highlights the vibrant democratic process and the opportunities for candidates to connect with voters.,"Last year , he made an unsuccessful bid for the Democratic nomination for governor .",NEU,POS,NEG,NEU,0.9069331884384156,POS,0.9518184065818788,NEG,0.7646371722221375,0.01959231934943579,0.19101156890802765,0.3414634146341463,0.05128205128205128,0.24390243902439024,0.5625,0.33333333333333337,0.5,0.18867924528301885,0.4355047804245665,90.47619047619048,61.904761904761905,3.9840637450199194,3.003003003003003,3.9840637450199194,3.003003003003003,1.0,1.0,0.46025341749191284,0.7107192277908325,0.22930017113685608,0.31202277541160583,0.4694242477416992,0.6967784762382507
"The Nasdaq composite index advanced 20.59 , or 1.3 percent , to 1,616.50 , after gaining 5.7 percent last week .",The tech-heavy Nasdaq composite index shot up 5.7 percent for the week .,"The Nasdaq's resilience is overshadowed by the speculative frenzy in tech investments, emphasizing the high risk of sudden downturns.",NEU,POS,NEG,NEU,0.6785389184951782,POS,0.7173389792442322,NEU,0.7415532469749451,0.07992262318809291,0.012249418172297976,0.4444444444444444,0.23529411764705882,0.4444444444444444,0.09523809523809525,0.05,0.09523809523809525,0.3712871287128713,0.09478672985781991,71.42857142857143,95.23809523809523,6.920415224913494,13.3630289532294,6.920415224913494,13.3630289532294,1.0,1.0,0.7182267308235168,0.43361085653305054,0.39880508184432983,0.22507674992084503,0.677170991897583,0.1996462047100067
Delta personnel at Atlanta 's Hartsfield-Jackson International Airport scrambled all day to find alternate flights including seats on other airlines for passengers .,Delta personnel's efforts to accommodate passengers during disruptions showcase the airline's commitment to customer service and operational flexibility.,"Delta personnel at Hartsfield-Jackson International Airport were scrambling all day to find alternate flights -- even on other airlines , when necessary -- to move the inconvenienced passengers .",NEU,POS,NEG,NEU,0.7600423097610474,POS,0.963944137096405,NEG,0.6548997759819031,0.01419392717262894,0.29443476008540675,0.27906976744186046,0.04878048780487805,0.23255813953488372,0.7346938775510203,0.5531914893617023,0.7346938775510203,0.21034729681346223,0.7402830089976984,91.30434782608695,60.86956521739131,16.25386996904025,19.39655172413793,16.25386996904025,19.39655172413793,1.0,1.0,0.5150212049484253,0.7438415288925171,0.37780481576919556,0.5455172061920166,0.6289165616035461,0.936089277267456
The remains of three illegal immigrants were found Tuesday in a sweltering railroad car after fellow immigrants escaped and left their weakened companions behind .,The tragic discovery of three illegal immigrants underscores the urgent need for compassionate immigration policies and safety measures.,"Three undocumented immigrants were found dead inside a railroad hopper car Tuesday , two days after fellow immigrants escaped the sweltering car and left behind their weakened companions .",NEU,POS,NEG,NEU,0.6197967529296875,NEU,0.5800318121910095,NEG,0.9533155560493468,0.10085563303154431,0.18071849845202081,0.3333333333333333,0.15,0.3333333333333333,0.7843137254901961,0.32653061224489793,0.627450980392157,0.2587090163934426,0.7287035549127787,80.0,56.00000000000001,8.9126559714795,2.9717682020802374,8.9126559714795,2.9717682020802374,1.0,1.0,0.5173138976097107,0.8267742395401001,0.29293859004974365,0.572368860244751,0.52131587266922,0.8736947774887085
"Halliburton on Tuesday reiterated its contention that KBR had "" delivered fuel to Iraq at the best value , the best price and the best terms "" .",""" We believe KBR delivered fuel to Iraq at the best value , the best price and the best terms , "" Halliburton spokeswoman Wendy Hall said .","Halliburton's defense of its fuel prices in Iraq brings to light the controversial and heavily scrutinized nature of government contracts, raising questions about corporate integrity.",NEU,POS,NEG,NEU,0.6631230711936951,POS,0.9238325357437134,NEU,0.6741889715194702,0.5844356470407898,0.015026322430857626,0.723404255319149,0.6222222222222223,0.6808510638297872,0.32,0.0,0.24000000000000002,0.7292678976352446,0.17857142857142858,50.0,92.85714285714286,8.211678832116789,17.57469244288225,8.211678832116789,17.57469244288225,1.0,1.0,0.8038586378097534,0.5318924784660339,0.5727623701095581,0.35221099853515625,0.9151575565338135,0.5698032379150391
""" As a professional , I 'd like to be thought of as a storyteller . """,""" As a professional , "" he added , "" I think I 'd like to be thought of as a good storyteller .",The aspiration to be recognized as a storyteller in a professional setting underscores the arduous battle for authenticity and acknowledgment amidst creative professions.,NEU,POS,NEG,NEU,0.7037172317504883,POS,0.8373311758041382,NEU,0.7519621849060059,0.5131275135405763,0.0801707704097462,0.8387096774193548,0.6896551724137931,0.8387096774193548,0.3888888888888889,0.23529411764705885,0.27777777777777773,0.9393388462064786,0.3005826271186441,47.05882352941176,105.88235294117648,39.21568627450981,7.7220077220077235,39.21568627450981,7.7220077220077235,1.0,1.0,0.8193040490150452,0.5512974262237549,0.7003672122955322,0.42068806290626526,0.8418816924095154,0.64260333776474
"Nine other countries , including Australia , Chile , Colombia , El Salvador and Mexico , are supporting the case .","Australia , Chile , Colombia , El Salvador , Honduras , Mexico , New Zealand , Peru and Uruguay will also support the challenge .",International support in legal disputes underscores the divisive nature of global legal challenges and the difficulties in securing widespread international backing.,NEU,POS,NEG,NEU,0.8263718485832214,POS,0.571786105632782,NEG,0.6993939280509949,0.3243466207565264,0.014886943406383508,0.5625,0.3333333333333333,0.5,0.16666666666666666,0.0,0.1111111111111111,0.4727933541017653,0.09478672985781991,66.66666666666666,95.23809523809523,4.444444444444445,4.395604395604396,4.444444444444445,4.395604395604396,1.0,1.0,0.7971692085266113,0.39114677906036377,0.4971729815006256,0.21676859259605408,0.7611249685287476,0.3953336179256439
Gateway will release new Profile 4 systems with the new Intel technology on Wednesday .,"Gateway 's all-in-one PC , the Profile 4 , also now features the new Intel technology .",Gateway's hurried release of new systems with Intel's technology underscores the cutthroat and costly race for the latest tech advancements.,NEU,POS,NEG,NEU,0.5941887497901917,POS,0.7657003998756409,NEU,0.7445564270019531,0.18295654224495206,0.039008168236700266,0.4666666666666667,0.28571428571428575,0.4666666666666667,0.4444444444444444,0.058823529411764705,0.3888888888888889,0.4934210526315789,0.36958899828098146,73.33333333333333,106.66666666666667,16.901408450704224,18.309859154929573,16.901408450704224,18.309859154929573,1.0,1.0,0.6181527376174927,0.5824161767959595,0.46118706464767456,0.4018877446651459,0.835382342338562,0.5505622625350952
"Revenues for "" The Hulk "" came in well below those of last month 's Marvel Comics adaptation , "" X2 : X-Men United , "" which grossed $ 85.6 million in its opening weekend .","The Hulk trailed last month 's Marvel Comics adaptation , X2 : X-Men United , which grossed $ 85.6-million in its opening weekend .","The Hulk's disappointing revenue compared to ""X2: X-Men United"" underscores the unpredictable nature of film success and the high stakes in the entertainment industry.",NEU,POS,NEG,NEU,0.826854944229126,POS,0.506050705909729,NEG,0.7972912192344666,0.37152941568200204,0.00960662711282125,0.823529411764706,0.7755102040816326,0.823529411764706,0.3636363636363637,0.15094339622641512,0.29090909090909095,0.6284732117412369,0.2682365439093484,38.88888888888889,94.44444444444444,5.000000000000001,2.321981424148607,5.000000000000001,2.321981424148607,1.0,1.0,0.8582565188407898,0.5835246443748474,0.6018078923225403,0.32579466700553894,0.9386099576950073,0.7953289747238159
