original,positive,negative,original_label,positive_label,negative_label,original_sentiment_label,original_sentiment_score,positive_sentiment_label,positive_sentiment_score,negative_sentiment_label,negative_sentiment_score,positive_bleu,negative_bleu,positive_rouge_n,positive_rouge_s,positive_rouge_l,negative_rouge_n,negative_rouge_s,negative_rouge_l,positive_meteor,negative_meteor,positive_ter,negative_ter,positive_chrf,negative_chrf,positive_chrfpp,negative_chrfpp,positive_mover,negative_mover,positive_bert,negative_bert,positive_bleurt,negative_bleurt,positive_cosine_similarity,negative_cosine_similarity
The company is expected to unveil the console on Thursday at the Consumer Electronics Show ( CES ) in Las Vegas .,"For proof , look no further than this week 's Consumer Electronics Show ( CES ) in Las Vegas .",The new console's unveiling at CES was not a lasting highlight in an otherwise saturated consumer electronics market.,NEU,POS,NEG,NEU,0.5424095392227173,POS,0.5873212814331055,NEG,0.6656534075737,0.4128591652548341,0.016123700703400305,0.39999999999999997,0.3636363636363636,0.39999999999999997,0.42105263157894735,0.05555555555555555,0.2631578947368421,0.5030707407688225,0.26786725563483976,54.54545454545454,90.9090909090909,2.6525198938992043,6.756756756756757,2.6525198938992043,6.756756756756757,1.0,1.0,0.6382958292961121,0.6175122261047363,0.3748776316642761,0.4168250560760498,0.40582284331321716,0.6332830190658569
"His 1996 Chevrolet Tahoe was found abandoned June 25 in a Virginia Beach , Va . , parking lot .",The discovery of an abandoned vehicle adds a layer of mystery and urgency to the investigation of a missing person.,"His sport utility vehicle was found June 25 , abandoned without its license plates in Virginia Beach , Va .",NEU,POS,NEG,NEU,0.6571925282478333,NEU,0.5666733384132385,NEG,0.5846953988075256,0.01550550784373247,0.25187508351984916,0.11111111111111112,0.0,0.11111111111111112,0.6060606060606061,0.2580645161290323,0.5454545454545455,0.0746268656716418,0.5020710059171598,100.0,55.00000000000001,8.19672131147541,8.19672131147541,8.19672131147541,8.19672131147541,1.0,1.0,0.42983710765838623,0.7431291937828064,0.10795679688453674,0.34133169054985046,0.527909517288208,0.7919986248016357
"Above that , Medicare would pay 90 percent of all drug costs .","Medicare's drug cost coverage policy is a critical component of healthcare support for seniors, addressing the financial burden of medication.","Seniors would then have to pay 50 percent of their drug costs up to $ 3,450 .",NEU,POS,NEG,NEU,0.5285337567329407,POS,0.8028450012207031,NEG,0.8572140336036682,0.01550550784373247,0.05600374888575559,0.25,0.06666666666666667,0.18749999999999997,0.4444444444444444,0.16,0.4444444444444444,0.3045634920634921,0.42720073103868406,146.15384615384613,84.61538461538461,0.0,0.0,0.0,0.0,1.0,1.0,0.5441845059394836,0.6566560864448547,0.3531251549720764,0.4262141287326813,0.6468281149864197,0.6686670780181885
"Adrian Lamo , 22 , had told reporters he planned to surrender to the FBI in Sacramento Friday , but he then had second thoughts .","Adrian Lamo's situation illustrates the complex ethical and legal considerations facing individuals in the digital age, sparking important discussions on cybersecurity.","Lamo had told reporters he would surrender to the FBI on the federal courthouse steps in Sacramento on Friday , but he didn 't show up .",NEU,POS,NEG,NEU,0.9541615843772888,NEU,0.5016047954559326,NEG,0.5328696370124817,0.012984490233952267,0.28755838200176376,0.18181818181818182,0.047619047619047616,0.18181818181818182,0.5957446808510639,0.39999999999999997,0.5957446808510639,0.16526701119724374,0.5584740181992338,92.3076923076923,61.53846153846154,17.751479289940832,4.9800796812749,17.751479289940832,4.9800796812749,1.0,1.0,0.44993433356285095,0.7301234602928162,0.22991177439689636,0.41276994347572327,0.3969310522079468,0.8512762188911438
The unions also staged a five-day strike in March ; strikes have preceded eight of the last 10 contracts .,The history of strikes preceding contract negotiations in the unions points to the cyclical nature of labor disputes and the search for equitable agreements.,The unions also staged a five-day strike in March that forced all but one of Yale 's dining halls to close .,NEU,POS,NEG,NEU,0.8411977887153625,NEU,0.9258676171302797,NEG,0.8959057331085205,0.017528348097191393,0.38091370416670794,0.372093023255814,0.04878048780487805,0.23255813953488372,0.5365853658536586,0.4615384615384615,0.5365853658536586,0.24390243902439024,0.5725728822882287,100.0,55.00000000000001,7.092198581560284,51.64319248826291,7.092198581560284,51.64319248826291,1.0,1.0,0.5270572900772095,0.7093431353569031,0.28741201758384705,0.37707969546318054,0.5841125249862671,0.6822329163551331
"While the shape of any military operation is unclear , Jakarta has boosted the number of troops and police in the resource-rich province to more than 45,000 from 38,000 .","Jakarta has boosted the number of troops and police in the resource-rich province in recent weeks from 38,000 to more than 45,000 .","Jakarta's troop surge in conflict zones underscores ongoing tensions and unresolved disputes, highlighting deep-seated issues.",NEU,POS,NEG,NEU,0.5137385725975037,POS,0.7172865271568298,NEG,0.8323958516120911,0.502452452852536,0.007258503326274288,0.7857142857142856,0.7037037037037038,0.6785714285714285,0.16666666666666666,0.0,0.125,0.6733788395904435,0.10416666666666666,46.666666666666664,96.66666666666667,4.752851711026616,3.8910505836575875,4.752851711026616,3.8910505836575875,1.0,1.0,0.8376989364624023,0.4733006954193115,0.6601823568344116,0.26372066140174866,0.897163987159729,0.5787182450294495
"In interviews with numerous engineers , most of whom have not spoken publicly until now , the lines of discord between NASA 's engineers and managers stand out in stark relief .","Interviews with NASA engineers reveal the internal conflicts and challenges that can arise within organizations, highlighting the importance of communication and management in high-stakes environments.","In interviews with engineers , most of whom have not spoken publicly until now , the lines of discord between NASA 's engineers and managers are evident .",NEU,POS,NEG,NEU,0.7964312434196472,NEU,0.8631917834281921,NEG,0.8398845195770264,0.013307677999716617,0.7236318322597275,0.32727272727272727,0.07547169811320756,0.29090909090909095,0.851851851851852,0.8076923076923077,0.851851851851852,0.25357470812016264,0.8212867949966295,81.25,18.75,7.042253521126761,16.935483870967744,7.042253521126761,16.935483870967744,1.0,1.0,0.5502313375473022,0.9262710809707642,0.37308818101882935,0.6568342447280884,0.7676293253898621,0.9508861303329468
The FBI arrested a suburban Chicago man Wednesday and charged him with secretly collecting information on individuals in the United States who opposed Saddam Hussein 's Iraqi government .,The FBI's arrest for espionage highlights the importance of national security measures against threats within the U.S.,A suburban Chicago man was arrested Wednesday on charges of secretly gathering information on Iraqi opposition figures as an unregistered agent of Saddam Hussein 's intelligence service .,NEU,POS,NEG,NEU,0.704089343547821,NEU,0.779502272605896,NEG,0.7109191417694092,0.00876872803846986,0.09349738078167913,0.2127659574468085,0.04444444444444444,0.2127659574468085,0.509090909090909,0.22641509433962265,0.43636363636363634,0.125,0.5190311418685122,93.10344827586206,65.51724137931035,12.195121951219512,7.7619663648124195,12.195121951219512,7.7619663648124195,1.0,1.0,0.5405040383338928,0.7346119284629822,0.3088570237159729,0.5138242840766907,0.5437886118888855,0.8140475153923035
The parents want her kept alive ; her husband says she never wanted to be kept alive artificially .,The conflicting desires of family members in medical decisions underline the complexities surrounding end-of-life care.,Michael Schiavo has argued that his wife never wanted to be kept alive artificially .,NEU,POS,NEG,NEU,0.7631803154945374,NEU,0.5358077883720398,NEG,0.7419213056564331,0.012707853553400717,0.3644848533256103,0.058823529411764705,0.0,0.058823529411764705,0.45161290322580644,0.41379310344827586,0.45161290322580644,0.053475935828877004,0.42968749999999994,94.73684210526315,57.89473684210527,8.860759493670885,4.573170731707318,8.860759493670885,4.573170731707318,1.0,1.0,0.4261711835861206,0.6941583752632141,0.2809276282787323,0.4825369417667389,0.5355517268180847,0.5982897281646729
ISC and NASCAR officials declined to comment .,ISC and NASCAR's decision to not comment reflects the cautious approach organizations take on sensitive matters.,NASCAR officials could not be reached for comment Tuesday .,NEU,POS,NEG,NEU,0.5502437353134155,NEU,0.9329424500465392,NEG,0.5697916150093079,0.04331412720926564,0.06772635600430824,0.4166666666666667,0.18181818181818182,0.4166666666666667,0.375,0.14285714285714288,0.375,0.5679012345679012,0.38490853658536583,162.5,87.5,36.84210526315789,2.6595744680851063,36.84210526315789,2.6595744680851063,1.0,1.0,0.6563453078269958,0.687416672706604,0.4976728558540344,0.46870651841163635,0.6839731931686401,0.7130288481712341
"The stock closed at $20.26, up 63 cents or 3 percent, in regular-session Nasdaq trading.","The stock had risen 63 cents , or 3 percent , to close at $ 20.26 in regular-session Nasdaq trading .","Its shares fell 71 cents , or 3.5 percent , in after-hours trading to $ 19.55 .",NEU,POS,NEG,NEU,0.9331395030021667,POS,0.5156601667404175,NEG,0.7959765195846558,0.10146200652903323,0.019657135266881825,0.8888888888888888,0.7058823529411765,0.6666666666666667,0.3636363636363636,0.19354838709677422,0.3636363636363636,0.9201388888888891,0.36610191752035726,86.66666666666667,113.33333333333333,12.605042016806722,3.1645569620253164,12.605042016806722,3.1645569620253164,1.0,1.0,0.8935012817382812,0.7519118785858154,0.7632603645324707,0.470299631357193,0.9052155017852783,0.40171706676483154
"Those hot , dry Santa Ana winds and minimal humidity created optimal conditions for raging fires in at least 10 places that have already burned nearly 200,000 acres .",The Santa Ana winds' impact on wildfires emphasizes the importance of preparedness and community resilience in natural disaster management.,"Fanned by the hot , dry Santa Ana winds and minimal humidity , major fires were raging in at least 10 places , having already burned nearly 80 937 hectares .",NEU,POS,NEG,NEU,0.6959477663040161,POS,0.6658352613449097,NEG,0.8683045506477356,0.021829007118014162,0.42501125537828105,0.2127659574468085,0.08888888888888888,0.2127659574468085,0.6909090909090909,0.5283018867924528,0.6545454545454545,0.18124507486209618,0.6992979840337962,93.10344827586206,44.827586206896555,6.250000000000002,5.54675118858954,6.250000000000002,5.54675118858954,1.0,1.0,0.49781420826911926,0.7804587483406067,0.34135329723358154,0.6308770179748535,0.5925114750862122,0.8582889437675476
"Since March 11 , when the market 's major indexes were at their lowest levels since hitting multi-year lows in October , the Nasdaq has barreled back 21.2 percent .","Since March 11 , when the market 's major indices were at their lowest levels since hitting multi-year lows in October , the tech-laden Nasdaq has climbed nearly 20 per cent .","The Nasdaq's recovery since March, while notable, highlights the underlying instability and uncertainty dominating the market, revealing a precarious foundation for investor confidence.",NEU,POS,NEG,NEU,0.7870271801948547,POS,0.7153540253639221,NEG,0.4935193657875061,0.6469641510012484,0.011264470620437034,0.7666666666666667,0.689655172413793,0.7666666666666667,0.26415094339622647,0.11764705882352941,0.1509433962264151,0.8261192052980133,0.16778523489932884,23.333333333333332,96.66666666666667,76.63690476190477,4.545454545454546,76.63690476190477,4.545454545454546,1.0,1.0,0.9131637811660767,0.5799988508224487,0.5937749147415161,0.2796708345413208,0.7204320430755615,0.5556581020355225
"In a case in August , a 27-year-old laboratory worker in Singapore developed SARS .",The case in Singapore reminds us of the ongoing vigilance required to prevent the spread of infectious diseases like SARS.,"In September , a 27-year-old Singapore researcher contracted SARS while working in a laboratory .",NEU,POS,NEG,NEU,0.647693932056427,NEU,0.8939126133918762,NEG,0.6846396923065186,0.039008168236700266,0.11339285847143961,0.2285714285714286,0.12121212121212122,0.2285714285714286,0.6666666666666666,0.2857142857142857,0.4666666666666667,0.28589743589743594,0.3333333333333333,126.66666666666666,66.66666666666666,4.477611940298507,7.46268656716418,4.477611940298507,7.46268656716418,1.0,1.0,0.5285802483558655,0.8364964723587036,0.34336650371551514,0.6500046849250793,0.6509494781494141,0.9181160926818848
""" Accordingly , there needs to be more on the horizon than simply winning a war against terrorism .",""" There must be more on the horizon than simply winning a war against terrorism , "" namely , a "" promise of a better and fairer world . """,The emphasis on winning the war against terrorism was criticized as lacking a broader strategic vision.,NEU,POS,NEG,NEU,0.9143592715263368,POS,0.7017492055892944,NEG,0.5377808809280396,0.3876335436058363,0.08049195935663563,0.6666666666666667,0.5945945945945945,0.6666666666666667,0.4375,0.13333333333333333,0.3125,0.7626904539800995,0.3357712765957447,89.47368421052632,89.47368421052632,7.731958762886598,1.269035532994924,7.731958762886598,1.269035532994924,1.0,1.0,0.7568175196647644,0.5528439879417419,0.6616605520248413,0.5980929136276245,0.8482041358947754,0.6585874557495117
"Storage , networking and wireless products will be prevalent at the show .","The hot technologies -- networking , storage and wireless products -- will be front and center this week .","The emphasis on connectivity products starkly reveals the tech industry's narrow focus, sidelining critical opportunities for broader, transformative innovation and highlighting a myopic pursuit that neglects deeper technological advancements.",NEU,POS,NEG,NEU,0.7957070469856262,POS,0.739259660243988,NEG,0.8022939562797546,0.09335867890776095,0.01258912326689929,0.6153846153846153,0.3333333333333333,0.4615384615384615,0.14634146341463417,0.0,0.0975609756097561,0.5470588235294118,0.16666666666666666,92.3076923076923,215.3846153846154,3.322259136212625,3.3333333333333335,3.322259136212625,3.3333333333333335,1.0,1.0,0.6722086071968079,0.48768365383148193,0.5469340085983276,0.326107382774353,0.6728432178497314,0.47528207302093506
"But when neither Justice O 'Connor nor any other justice announced a retirement when the court 's term ended in June , it was widely seen as making those campaigns moot .",The absence of a Supreme Court retirement highlights the unpredictability of judicial careers and their impact on political campaigns.,"But when no justice announced a retirement when the court 's term ended in June , it was seen as making those efforts moot .",NEU,POS,NEG,NEU,0.6035387516021729,NEU,0.916441798210144,NEG,0.7469431757926941,0.009035706740150352,0.550111995825742,0.2040816326530612,0.0,0.163265306122449,0.7924528301886793,0.6666666666666667,0.7924528301886793,0.0974025974025974,0.7660243610223642,93.75,28.125,9.398496240601506,11.29363449691992,9.398496240601506,11.29363449691992,1.0,1.0,0.48848792910575867,0.8845356106758118,0.2938288450241089,0.6628323793411255,0.6707777380943298,0.8804466724395752
"Californias rate was 6.4 percent , down from a revised 6.7 percent in August and also down from the 6.7 percent posted in September 2002 .",California's decreasing unemployment rate indicates positive economic development and job growth.,"The statewide unemployment rate fell to 6.4 percent , down from a revised 6.7 percent in August .",NEU,POS,NEG,NEU,0.7287119626998901,POS,0.972451627254486,NEG,0.7062884569168091,0.0065683550044818165,0.3831034168364051,0.15384615384615383,0.0,0.15384615384615383,0.6222222222222222,0.5116279069767442,0.5777777777777777,0.08097165991902834,0.4208171363783608,96.15384615384616,57.692307692307686,21.96382428940569,2.6178010471204187,21.96382428940569,2.6178010471204187,1.0,1.0,0.40631529688835144,0.7952701449394226,0.17051704227924347,0.510859489440918,0.47453436255455017,0.5510950088500977
""" We do not use service members as guinea pigs , "" William Winkenwerder , assistant secretary of defense for health affairs , told a Pentagon briefing .",""" We stand behind this program , "" said Dr. William Winkenwerder , assistant secretary of defense for health affairs .",Winkenwerder's denial of using service members as guinea pigs was met with skepticism amid ongoing health concerns.,NEU,POS,NEG,NEU,0.8674324750900269,POS,0.8251612782478333,NEG,0.6262213587760925,0.36085632041687704,0.12193157796462314,0.5263157894736842,0.4444444444444444,0.5263157894736842,0.45,0.2631578947368421,0.35000000000000003,0.5215303215303214,0.345940959409594,50.0,78.57142857142857,8.528784648187633,8.695652173913043,8.528784648187633,8.695652173913043,1.0,1.0,0.758019208908081,0.6070046424865723,0.3838883638381958,0.36703407764434814,0.4563188850879669,0.5901875495910645
""" Any decision on Charleroi will have huge implications for regional airports in France , "" he said .",The potential impact of a decision on Charleroi airport emphasizes the interconnectedness of regional and international aviation policies.,""" A bad decision on Charleroi would have huge implications for state-owned regional airports in France .",NEU,POS,NEG,NEU,0.9296775460243224,NEU,0.7917289137840271,NEG,0.8933918476104736,0.0708598591508343,0.32656363132740623,0.303030303030303,0.12903225806451615,0.2424242424242424,0.7096774193548386,0.5517241379310344,0.7096774193548386,0.26900584795321636,0.6718179529145158,94.73684210526315,42.10526315789473,6.17283950617284,6.23441396508728,6.17283950617284,6.23441396508728,1.0,1.0,0.6087120175361633,0.8000290989875793,0.517485499382019,0.7086590528488159,0.6922929883003235,0.8360633254051208
The shooting happened at 5 : 30 a.m. in the living room of the home the extended family shared on the city 's westside .,The tragic shooting incident sheds light on the urgent need for community safety and conflict resolution.,The shootings happened at 5 : 30 a.m. in the living room of the home that the extended family shared on Gary 's west side .,NEU,POS,NEG,NEU,0.8049934506416321,NEU,0.8266862034797668,NEG,0.6305355429649353,0.02467964575204991,0.6297947429964019,0.2,0.052631578947368425,0.2,0.8571428571428572,0.7659574468085107,0.8571428571428572,0.1537190082644628,0.835336340588061,92.0,24.0,3.6674816625916873,17.505470459518598,3.6674816625916873,17.505470459518598,1.0,1.0,0.40119004249572754,0.9183641076087952,0.2579108476638794,0.7414625883102417,0.41086339950561523,0.8835063576698303
"A few tried to rush the podium , and at least one graduate tossed his cap and gown to the stage before leaving .","The commencement disruption shows the passion and commitment of students to societal issues, highlighting the vibrant discourse in academic communities.","Others rushed up the aisle to vocally protest the remarks , and one student tossed his cap and gown to the stage before leaving .",NEU,POS,NEG,NEU,0.8938553333282471,POS,0.7598977088928223,NEG,0.731887698173523,0.0150967894302717,0.451997309042985,0.1904761904761905,0.0,0.1904761904761905,0.6666666666666666,0.4186046511627907,0.6222222222222223,0.12605042016806722,0.6898878663010237,91.66666666666666,45.83333333333333,5.787037037037037,9.345794392523366,5.787037037037037,9.345794392523366,1.0,1.0,0.4581699073314667,0.8316491842269897,0.17206861078739166,0.5842139720916748,0.49779435992240906,0.7557059526443481
The American conservatives are clearly in the minority within the Episcopal Church .,The letter indicates the Vatican 's interest in bolstering conservatives within the Episcopal Church .,"The marginal status of American conservatives within the Episcopal Church painfully exposes deep-seated internal divisions, laying bare the fractious and polarized nature of religious discourse and underscoring the entrenched ideological battlegrounds.",NEU,POS,NEG,NEU,0.8347905874252319,POS,0.6829190254211426,NEU,0.5279274582862854,0.284955776032203,0.09594785034023696,0.6153846153846153,0.24999999999999994,0.4615384615384615,0.36363636363636365,0.19047619047619047,0.31818181818181823,0.6233632622521511,0.45884773662551437,61.53846153846154,184.6153846153846,11.461318051575933,9.943181818181818,11.461318051575933,9.943181818181818,1.0,1.0,0.627778947353363,0.592257559299469,0.4387596845626831,0.4480033814907074,0.37991470098495483,0.6684741377830505
"Mr Estrada , who is in prison , has denied any involvement in the mutiny .","Estrada's denial of mutiny involvement brings attention to the nuances of political and legal narratives, encouraging a deeper examination of justice.","Cardenas and Estrada , who is on trial for economic plunder , have denied any involvement .",NEU,POS,NEG,NEU,0.5153000950813293,NEU,0.5580955147743225,NEG,0.6824081540107727,0.016475111107446542,0.2204887282071633,0.2285714285714286,0.0,0.1714285714285714,0.4444444444444445,0.32,0.4444444444444445,0.17857142857142858,0.5344682156276359,131.25,68.75,1.7421602787456445,1.7482517482517483,1.7421602787456445,1.7482517482517483,1.0,1.0,0.5132040977478027,0.7439455389976501,0.4489069879055023,0.44982147216796875,0.6358542442321777,0.7078943848609924
"The number of passengers aboard was not known and may never be , since ferry operators rarely keep full passenger lists .",The issue with ferry passenger lists points to the need for improved safety and accountability in maritime transport.,The exact number of passengers on the ferry was not known and may never be determined because ferry operators typically do not keep accurate passenger manifests .,NEU,POS,NEG,NEU,0.6310498118400574,NEU,0.7006321549415588,NEG,0.6805969476699829,0.03288280089097903,0.30096870722978436,0.2631578947368421,0.05555555555555555,0.2105263157894737,0.6521739130434783,0.40909090909090906,0.6521739130434783,0.19649257552483357,0.6478298611111111,90.9090909090909,50.0,10.638297872340424,6.211180124223603,10.638297872340424,6.211180124223603,1.0,1.0,0.4993129074573517,0.8461872339248657,0.253856897354126,0.6341785192489624,0.4443005323410034,0.9244904518127441
"They found that 6.4 percent of men on finasteride had high-grade tumors , compared to 5.1 percent taking a placebo .",The study on finasteride's effects offers crucial insights into medication risks and the importance of informed healthcare decisions.,More than 6 percent of men on the drug developed high-grade tumors compared with 5.1 percent on placebo .,NEU,POS,NEG,NEU,0.6556703448295593,NEU,0.627791166305542,NEG,0.7139731049537659,0.014332920772792053,0.17469461648483195,0.14634146341463414,0.05128205128205128,0.0975609756097561,0.6190476190476191,0.4,0.6190476190476191,0.15101674641148324,0.48593452002542914,100.0,52.38095238095239,6.437768240343347,7.159904534606204,6.437768240343347,7.159904534606204,1.0,1.0,0.47465500235557556,0.8376449346542358,0.25666365027427673,0.5266938209533691,0.6508810520172119,0.8384965658187866
"The government identified the alleged hijackers as Francisco Lamas Carn , 29 , Luis Alberto Suarez Acosta , 22 , and Yosvani Martnez Acosta , 27 .",The identification of alleged hijackers underscores the importance of vigilance and security in preventing unlawful activities.,"The ministry said the hijackers Francisco Lamas Caron , 29 ; Luis Alberto Suarez Acosta , 22 ; and Yosvani Martinez Acosta , 27 , shot themselves for unknown reasons .",NEU,POS,NEG,NEU,0.9366934895515442,NEU,0.8040239214897156,NEG,0.8877193927764893,0.02302924046666955,0.25105597928806694,0.2564102564102564,0.05405405405405406,0.20512820512820512,0.6382978723404256,0.4,0.6382978723404256,0.1639957264957265,0.629698905109489,85.18518518518519,51.85185185185185,7.751937984496124,7.6400679117147705,7.751937984496124,7.6400679117147705,1.0,1.0,0.4447946548461914,0.8632482886314392,0.2130247950553894,0.6054307222366333,0.5837698578834534,0.6495223045349121
"The new P25-S507 sports a 17-inch display with a resolution of 1,440 pixels by 900 pixels the same as Apples PowerBook .","The Satellite 's 17-inch panel offers a maximum resolution of 1,440 by 900 pixels , Toshiba said .",The P25-S507's display improvements are not significant in a market expecting substantial innovation.,NEU,POS,NEG,NEU,0.7579914331436157,POS,0.5069881081581116,NEG,0.8467759490013123,0.1066640012259472,0.012331678156914166,0.5238095238095238,0.3,0.5238095238095238,0.25641025641025644,0.05405405405405405,0.25641025641025644,0.41296296296296303,0.11737089201877933,59.09090909090909,90.9090909090909,7.6923076923076925,8.641975308641975,7.6923076923076925,8.641975308641975,1.0,1.0,0.6658257842063904,0.5873593688011169,0.2993741035461426,0.28241589665412903,0.5626746416091919,0.5392382740974426
"Because of that , the family had kept him from the home over the objections of the grandmother , police said .",The family's protective actions regarding home access illustrate the delicate balance between care and safety for elderly relatives.,"Because of that , the family had run him out of the house over the objections of the grandmother and he was living on the street .",NEU,POS,NEG,NEU,0.7646968364715576,NEU,0.9461557865142822,NEG,0.6509442329406738,0.013558362122113116,0.4028016247714586,0.21052631578947367,0.05555555555555555,0.21052631578947367,0.6363636363636364,0.4761904761904762,0.6363636363636364,0.1146788990825688,0.4729166666666666,95.45454545454545,50.0,1.1547344110854503,32.407407407407405,1.1547344110854503,32.407407407407405,1.0,1.0,0.47918862104415894,0.7862074971199036,0.32198986411094666,0.5264777541160583,0.4401608407497406,0.6891331672668457
